;
Quels sont les derniers mouvements d'espèces que nous avons enregistrés ?;
Je cherche à savoir les dernières remises en espèces de notre compte.;
Pourrais-tu me donner les détails des dernières remises en espèces ?;
Quelles ont été les dernières opérations d'espèces effectuées ?;
Peux-tu me dire combien j'ai payé à l'URSSAF le mois dernier ?;Quel est le montant de l’URSSAF du dernier mois ?
J'aimerais savoir le total des contributions URSSAF du mois précédent.;
Quelle a été ma charge URSSAF pour le dernier mois ?;
Pourrais-tu m'indiquer le paiement URSSAF du mois passé ?;
Combien ai-je versé à l'URSSAF le mois dernier ?;
Quel a été le coût de l'URSSAF pour le mois précédent ?;
Peux-tu vérifier le montant que j'ai payé à l'URSSAF récemment ?;
Je voudrais connaître le montant de l'URSSAF du dernier mois.;
Montre-moi le total payé à l'URSSAF pour le mois dernier.;
Comment puis-je trouver le montant de l'URSSAF du mois précédent ?;
Peux-tu me fournir les détails du paiement à l'URSSAF du mois dernier ?;
Quel montant a été débité pour l'URSSAF le mois dernier ?;
Pourrais-tu me dire le total de l'URSSAF pour le dernier mois ?;
Je cherche le montant exact payé à l'URSSAF le mois précédent.;
Quel était le coût de l'URSSAF pour le dernier mois facturé ?;
Peux-tu m'afficher le montant de l'URSSAF du mois dernier ?;
Comment voir ce que j'ai dépensé pour l'URSSAF le mois dernier ?;
Quelle somme ai-je versée à l'URSSAF pour le dernier mois ?;
Je souhaite savoir le total versé à l'URSSAF le mois précédent.;
Pourrais-tu m'informer sur le montant total dû à l'URSSAF le mois dernier ?;
Peux-tu me donner le montant de mes factures EDF par mois ?;Quel est le montant de mes factures EDF par mois ? Peux-tu ?
Combien ai-je payé chaque mois pour l'électricité chez EDF ?;Quel est le montant de mes factures EDF par mois ?
Je voudrais connaître le coût mensuel de mes factures d'électricité EDF.;
Peux-tu me dire le total mensuel de mes paiements à EDF ?;
Quelle est la somme que je dépense en moyenne par mois chez EDF ?;
Comment puis-je voir le montant de chaque facture EDF par mois ?;
Pourrais-tu m'indiquer mes dépenses EDF mensuelles ?;
Je veux savoir combien coûte mon électricité avec EDF tous les mois.;
Montre-moi le détail de ce que je paie à EDF mois par mois.;
Quel est le montant facturé par EDF pour chaque mois ?;
Peux-tu m'afficher le total de mes factures mensuelles chez EDF ?;
Comment accéder aux montants mensuels de mes factures EDF ?;
Peux-tu calculer le coût total mensuel de l'électricité pour moi chez EDF ?;
J'aimerais un aperçu des montants mensuels que je verse à EDF.;
Quel est le montant exact facturé par EDF mensuellement ?;
Comment suivre le montant de mes factures EDF sur une base mensuelle ?;
Pourrais-tu me fournir les chiffres de mes factures EDF par mois ?;
Je souhaite examiner le montant de chaque facture mensuelle d'EDF.;
Quelle est la valeur de mes factures mensuelles avec EDF ?;
Comment déterminer le montant de mes paiements mensuels à EDF ?;
Quels sont les montants que j'ai payés à EDF chaque mois ?;
Quel est mon xxx ?;Quel est mon xxx ?
Quel est mon chiffre d’affaires ?;Quel est mon chiffre d’affaires ?
Pourrais-tu m'indiquer mes dépenses fff mensuelles ?;Pourrais-tu m'indiquer mes dépenses fff mensuelles ?
